ticker,source,title,description,content,url,publishedAt
MSFT,ETF Daily News,Microsoft Co. (NASDAQ:MSFT) Shares Sold by Cookson Peirce & Co. Inc.,"Cookson Peirce & Co. Inc. lowered its stake in Microsoft Co. (NASDAQ:MSFT – Free Report) by 1.2% during the fourth quarter, according to its most recent disclosure with the Securities and Exchange Commission (SEC). The fund owned 207,780 shares of the softwar…","Cookson Peirce &amp; Co. Inc. lowered its stake in Microsoft Co. (NASDAQ:MSFT – Free Report) by 1.2% during the fourth quarter, according to its most recent disclosure with the Securities and Exchang… [+5549 chars]",https://www.etfdailynews.com/2025/05/11/microsoft-co-nasdaqmsft-shares-sold-by-cookson-peirce-co-inc/,2025-05-11 07:23:00+00:00
MSFT,ETF Daily News,XXEC Inc. Reduces Position in Microsoft Co. (NASDAQ:MSFT),"XXEC Inc. reduced its position in shares of Microsoft Co. (NASDAQ:MSFT – Free Report) by 3.4% in the 4th quarter, according to the company in its most recent filing with the Securities and Exchange Commission. The firm owned 29,671 shares of the software gian…","XXEC Inc. reduced its position in shares of Microsoft Co. (NASDAQ:MSFT – Free Report) by 3.4% in the 4th quarter, according to the company in its most recent filing with the Securities and Exchange C… [+6002 chars]",https://www.etfdailynews.com/2025/05/11/xxec-inc-reduces-position-in-microsoft-co-nasdaqmsft/,2025-05-11 07:22:59+00:00
MSFT,ETF Daily News,Microsoft Co. (NASDAQ:MSFT) Holdings Cut by Kapstone Financial Advisors LLC,"Kapstone Financial Advisors LLC lowered its stake in shares of Microsoft Co. (NASDAQ:MSFT – Free Report) by 3.3% in the fourth quarter, Holdings Channel reports. The institutional investor owned 9,754 shares of the software giant’s stock after selling 335 sha…","Kapstone Financial Advisors LLC lowered its stake in shares of Microsoft Co. (NASDAQ:MSFT – Free Report) by 3.3% in the fourth quarter, Holdings Channel reports. The institutional investor owned 9,75… [+6182 chars]",https://www.etfdailynews.com/2025/05/11/microsoft-co-nasdaqmsft-holdings-cut-by-kapstone-financial-advisors-llc/,2025-05-11 07:22:58+00:00
MSFT,ETF Daily News,Microsoft Co. (NASDAQ:MSFT) Position Increased by Abbot Financial Management Inc.,"Abbot Financial Management Inc. grew its holdings in Microsoft Co. (NASDAQ:MSFT – Free Report) by 0.3% during the 4th quarter, Holdings Channel reports. The firm owned 34,844 shares of the software giant’s stock after buying an additional 112 shares during th…","Abbot Financial Management Inc. grew its holdings in Microsoft Co. (NASDAQ:MSFT – Free Report) by 0.3% during the 4th quarter, Holdings Channel reports. The firm owned 34,844 shares of the software g… [+6148 chars]",https://www.etfdailynews.com/2025/05/11/microsoft-co-nasdaqmsft-position-increased-by-abbot-financial-management-inc/,2025-05-11 07:22:58+00:00
MSFT,ETF Daily News,Carrera Capital Advisors Has $2.40 Million Stock Holdings in Microsoft Co. (NASDAQ:MSFT),"Carrera Capital Advisors raised its stake in Microsoft Co. (NASDAQ:MSFT – Free Report) by 11.5% during the 4th quarter, according to the company in its most recent disclosure with the Securities and Exchange Commission (SEC). The fund owned 5,684 shares of th…","Carrera Capital Advisors raised its stake in Microsoft Co. (NASDAQ:MSFT – Free Report) by 11.5% during the 4th quarter, according to the company in its most recent disclosure with the Securities and … [+5834 chars]",https://www.etfdailynews.com/2025/05/11/carrera-capital-advisors-has-2-40-million-stock-holdings-in-microsoft-co-nasdaqmsft/,2025-05-11 07:22:55+00:00
MSFT,ETF Daily News,Microsoft Co. (NASDAQ:MSFT) Shares Bought by Mainstream Capital Management LLC,"Mainstream Capital Management LLC increased its holdings in Microsoft Co. (NASDAQ:MSFT – Free Report) by 0.6% during the 4th quarter, Holdings Channel.com reports. The institutional investor owned 5,136 shares of the software giant’s stock after purchasing an…","Mainstream Capital Management LLC increased its holdings in Microsoft Co. (NASDAQ:MSFT – Free Report) by 0.6% during the 4th quarter, Holdings Channel.com reports. The institutional investor owned 5,… [+5491 chars]",https://www.etfdailynews.com/2025/05/11/microsoft-co-nasdaqmsft-shares-bought-by-mainstream-capital-management-llc/,2025-05-11 07:22:53+00:00
MSFT,ETF Daily News,Keybank National Association OH Has $1.17 Billion Stock Holdings in Microsoft Co. (NASDAQ:MSFT),"Keybank National Association OH decreased its position in Microsoft Co. (NASDAQ:MSFT – Free Report) by 0.0% during the fourth quarter, HoldingsChannel.com reports. The firm owned 2,769,470 shares of the software giant’s stock after selling 357 shares during t…","Keybank National Association OH decreased its position in Microsoft Co. (NASDAQ:MSFT – Free Report) by 0.0% during the fourth quarter, HoldingsChannel.com reports. The firm owned 2,769,470 shares of … [+5424 chars]",https://www.etfdailynews.com/2025/05/11/keybank-national-association-oh-has-1-17-billion-stock-holdings-in-microsoft-co-nasdaqmsft/,2025-05-11 07:22:52+00:00
MSFT,ETF Daily News,Crew Capital Management Ltd. Has $4.55 Million Position in Microsoft Co. (NASDAQ:MSFT),"Crew Capital Management Ltd. grew its stake in shares of Microsoft Co. (NASDAQ:MSFT – Free Report) by 2.3% during the fourth quarter, according to the company in its most recent disclosure with the Securities and Exchange Commission. The fund owned 10,782 sha…","Crew Capital Management Ltd. grew its stake in shares of Microsoft Co. (NASDAQ:MSFT – Free Report) by 2.3% during the fourth quarter, according to the company in its most recent disclosure with the S… [+6080 chars]",https://www.etfdailynews.com/2025/05/11/crew-capital-management-ltd-has-4-55-million-position-in-microsoft-co-nasdaqmsft/,2025-05-11 07:22:51+00:00
MSFT,ETF Daily News,Ring Mountain Capital LLC Acquires New Stake in Microsoft Co. (NASDAQ:MSFT),"Ring Mountain Capital LLC bought a new position in Microsoft Co. (NASDAQ:MSFT – Free Report) during the 4th quarter, according to its most recent Form 13F filing with the Securities & Exchange Commission. The fund bought 23,012 shares of the software giant’s …","Ring Mountain Capital LLC bought a new position in Microsoft Co. (NASDAQ:MSFT – Free Report) during the 4th quarter, according to its most recent Form 13F filing with the Securities &amp; Exchange Co… [+5456 chars]",https://www.etfdailynews.com/2025/05/11/ring-mountain-capital-llc-acquires-new-stake-in-microsoft-co-nasdaqmsft/,2025-05-11 07:22:51+00:00
MSFT,ETF Daily News,Mason Investment Advisory Services Inc. Lowers Position in Microsoft Co. (NASDAQ:MSFT),"Mason Investment Advisory Services Inc. decreased its holdings in shares of Microsoft Co. (NASDAQ:MSFT – Free Report) by 3.4% during the fourth quarter, according to its most recent filing with the SEC. The firm owned 2,089 shares of the software giant’s stoc…","Mason Investment Advisory Services Inc. decreased its holdings in shares of Microsoft Co. (NASDAQ:MSFT – Free Report) by 3.4% during the fourth quarter, according to its most recent filing with the S… [+6143 chars]",https://www.etfdailynews.com/2025/05/11/mason-investment-advisory-services-inc-lowers-position-in-microsoft-co-nasdaqmsft/,2025-05-11 07:22:51+00:00
MSFT,ETF Daily News,Best Technology Stocks To Watch Now – May 9th,"NVIDIA, Apple, Meta Platforms, Microsoft, Alphabet, Trade Desk, and Coinbase Global are the seven Technology stocks to watch today, according to MarketBeat’s stock screener tool. Technology stocks are shares of companies that develop, manufacture, or sell pro…","NVIDIA, Apple, Meta Platforms, Microsoft, Alphabet, Trade Desk, and Coinbase Global are the seven Technology stocks to watch today, according to MarketBeat’s stock screener tool. Technology stocks ar… [+8340 chars]",https://www.etfdailynews.com/2025/05/11/best-technology-stocks-to-watch-now-may-9th/,2025-05-11 06:06:47+00:00
MSFT,Yahoo Entertainment,"MSFT, PLTR, and NVDA: Daniel Ives Picks the Best AI Stocks to Buy","AI promises to transform nearly everything about our world, in ways possibly more profound than anything since the Industrial Revolution kicked off in the...","AI promises to transform nearly everything about our world, in ways possibly more profound than anything since the Industrial Revolution kicked off in the 1760s. The technology is already automating … [+13589 chars]",https://finance.yahoo.com/news/msft-pltr-nvda-daniel-ives-102032665.html,2025-05-10 10:20:32+00:00
MSFT,ETF Daily News,Microsoft Co. (NASDAQ:MSFT) Holdings Lifted by Charles Schwab Investment Management Inc.,"Charles Schwab Investment Management Inc. raised its position in Microsoft Co. (NASDAQ:MSFT – Free Report) by 3.9% in the 4th quarter, HoldingsChannel reports. The institutional investor owned 49,052,704 shares of the software giant’s stock after purchasing a…","Charles Schwab Investment Management Inc. raised its position in Microsoft Co. (NASDAQ:MSFT – Free Report) by 3.9% in the 4th quarter, HoldingsChannel reports. The institutional investor owned 49,052… [+6137 chars]",https://www.etfdailynews.com/2025/05/10/microsoft-co-nasdaqmsft-holdings-lifted-by-charles-schwab-investment-management-inc/,2025-05-10 07:10:47+00:00
MSFT,ETF Daily News,Burt Wealth Advisors Grows Holdings in Microsoft Co. (NASDAQ:MSFT),"Burt Wealth Advisors boosted its stake in shares of Microsoft Co. (NASDAQ:MSFT – Free Report) by 1.2% in the fourth quarter, according to the company in its most recent 13F filing with the Securities & Exchange Commission. The institutional investor owned 11,…","Burt Wealth Advisors boosted its stake in shares of Microsoft Co. (NASDAQ:MSFT – Free Report) by 1.2% in the fourth quarter, according to the company in its most recent 13F filing with the Securities… [+5990 chars]",https://www.etfdailynews.com/2025/05/10/burt-wealth-advisors-grows-holdings-in-microsoft-co-nasdaqmsft/,2025-05-10 07:10:47+00:00
MSFT,ETF Daily News,WMG Financial Advisors LLC Acquires 428 Shares of Microsoft Co. (NASDAQ:MSFT),"WMG Financial Advisors LLC grew its holdings in shares of Microsoft Co. (NASDAQ:MSFT – Free Report) by 5.2% in the fourth quarter, HoldingsChannel reports. The fund owned 8,723 shares of the software giant’s stock after purchasing an additional 428 shares dur…","WMG Financial Advisors LLC grew its holdings in shares of Microsoft Co. (NASDAQ:MSFT – Free Report) by 5.2% in the fourth quarter, HoldingsChannel reports. The fund owned 8,723 shares of the software… [+5559 chars]",https://www.etfdailynews.com/2025/05/10/wmg-financial-advisors-llc-acquires-428-shares-of-microsoft-co-nasdaqmsft/,2025-05-10 07:10:47+00:00
MSFT,ETF Daily News,Microsoft Co. (NASDAQ:MSFT) Holdings Trimmed by Commerzbank Aktiengesellschaft FI,"Commerzbank Aktiengesellschaft FI lowered its position in shares of Microsoft Co. (NASDAQ:MSFT – Free Report) by 3.9% in the fourth quarter, according to the company in its most recent 13F filing with the SEC. The fund owned 862,865 shares of the software gia…","Commerzbank Aktiengesellschaft FI lowered its position in shares of Microsoft Co. (NASDAQ:MSFT – Free Report) by 3.9% in the fourth quarter, according to the company in its most recent 13F filing wit… [+6183 chars]",https://www.etfdailynews.com/2025/05/10/microsoft-co-nasdaqmsft-holdings-trimmed-by-commerzbank-aktiengesellschaft-fi/,2025-05-10 07:10:47+00:00
MSFT,ETF Daily News,Wernau Asset Management Inc. Takes $5.83 Million Position in Microsoft Co. (NASDAQ:MSFT),"Wernau Asset Management Inc. bought a new position in Microsoft Co. (NASDAQ:MSFT – Free Report) in the fourth quarter, according to its most recent 13F filing with the Securities & Exchange Commission. The institutional investor bought 13,818 shares of the so…","Wernau Asset Management Inc. bought a new position in Microsoft Co. (NASDAQ:MSFT – Free Report) in the fourth quarter, according to its most recent 13F filing with the Securities &amp; Exchange Commi… [+5567 chars]",https://www.etfdailynews.com/2025/05/10/wernau-asset-management-inc-takes-5-83-million-position-in-microsoft-co-nasdaqmsft/,2025-05-10 07:10:46+00:00
MSFT,ETF Daily News,"Scratch Capital LLC Makes New $742,000 Investment in Microsoft Co. (NASDAQ:MSFT)","Scratch Capital LLC acquired a new stake in shares of Microsoft Co. (NASDAQ:MSFT – Free Report) during the 4th quarter, according to the company in its most recent 13F filing with the Securities and Exchange Commission (SEC). The institutional investor acquir…","Scratch Capital LLC acquired a new stake in shares of Microsoft Co. (NASDAQ:MSFT – Free Report) during the 4th quarter, according to the company in its most recent 13F filing with the Securities and … [+5869 chars]",https://www.etfdailynews.com/2025/05/10/scratch-capital-llc-makes-new-742000-investment-in-microsoft-co-nasdaqmsft/,2025-05-10 07:10:46+00:00
MSFT,ETF Daily News,James Reed Financial Services Inc. Invests $1.34 Million in Microsoft Co. (NASDAQ:MSFT),"James Reed Financial Services Inc. purchased a new position in shares of Microsoft Co. (NASDAQ:MSFT – Free Report) in the fourth quarter, Holdings Channel reports. The fund purchased 3,173 shares of the software giant’s stock, valued at approximately $1,337,0…","James Reed Financial Services Inc. purchased a new position in shares of Microsoft Co. (NASDAQ:MSFT – Free Report) in the fourth quarter, Holdings Channel reports. The fund purchased 3,173 shares of … [+5868 chars]",https://www.etfdailynews.com/2025/05/10/james-reed-financial-services-inc-invests-1-34-million-in-microsoft-co-nasdaqmsft/,2025-05-10 07:10:46+00:00
MSFT,ETF Daily News,Resolute Wealth Strategies LLC Has $3.07 Million Stock Position in Microsoft Co. (NASDAQ:MSFT),"Resolute Wealth Strategies LLC raised its stake in Microsoft Co. (NASDAQ:MSFT – Free Report) by 3.4% in the fourth quarter, according to the company in its most recent filing with the Securities and Exchange Commission (SEC). The firm owned 7,277 shares of th…","Resolute Wealth Strategies LLC raised its stake in Microsoft Co. (NASDAQ:MSFT – Free Report) by 3.4% in the fourth quarter, according to the company in its most recent filing with the Securities and … [+6024 chars]",https://www.etfdailynews.com/2025/05/10/resolute-wealth-strategies-llc-has-3-07-million-stock-position-in-microsoft-co-nasdaqmsft/,2025-05-10 07:10:45+00:00
MSFT,ETF Daily News,Microsoft Co. (NASDAQ:MSFT) Shares Sold by Planning Alternatives Ltd. ADV,"Planning Alternatives Ltd. ADV lessened its holdings in shares of Microsoft Co. (NASDAQ:MSFT – Free Report) by 6.1% during the 4th quarter, according to its most recent disclosure with the SEC. The institutional investor owned 5,118 shares of the software gia…","Planning Alternatives Ltd. ADV lessened its holdings in shares of Microsoft Co. (NASDAQ:MSFT – Free Report) by 6.1% during the 4th quarter, according to its most recent disclosure with the SEC. The i… [+6192 chars]",https://www.etfdailynews.com/2025/05/10/microsoft-co-nasdaqmsft-shares-sold-by-planning-alternatives-ltd-adv/,2025-05-10 07:10:45+00:00
MSFT,ETF Daily News,Bravias Capital Group LLC Invests $1.15 Million in Microsoft Co. (NASDAQ:MSFT),"Bravias Capital Group LLC purchased a new position in shares of Microsoft Co. (NASDAQ:MSFT – Free Report) in the 4th quarter, HoldingsChannel reports. The firm purchased 2,771 shares of the software giant’s stock, valued at approximately $1,150,000. Microsoft…","Bravias Capital Group LLC purchased a new position in shares of Microsoft Co. (NASDAQ:MSFT – Free Report) in the 4th quarter, HoldingsChannel reports. The firm purchased 2,771 shares of the software … [+5734 chars]",https://www.etfdailynews.com/2025/05/10/bravias-capital-group-llc-invests-1-15-million-in-microsoft-co-nasdaqmsft/,2025-05-10 07:10:45+00:00
MSFT,ETF Daily News,Top Technology Stocks To Research – May 8th,"NVIDIA, Alphabet, and Microsoft are the three Technology stocks to watch today, according to MarketBeat’s stock screener tool. Technology stocks are shares of companies that develop, manufacture, or provide services related to computing, electronics, software…","NVIDIA, Alphabet, and Microsoft are the three Technology stocks to watch today, according to MarketBeat’s stock screener tool. Technology stocks are shares of companies that develop, manufacture, or … [+3948 chars]",https://www.etfdailynews.com/2025/05/10/top-technology-stocks-to-research-may-8th/,2025-05-10 06:03:12+00:00
