ticker,date,title,description,clean_text,Close,Daily_Return
STRYKER CORPORATION,2025-01-13,"Inspire Medical Systems, Inc. Announces Preliminary Results for the Fourth Quarter and Full Year 2024 and Provides Initial 2025 Revenue Guidance",Inspire Reports Year-over-Year Revenue Growth of 25% for the Fourth Quarter and 28% for the Full Year 2024 Inspire Reports Year-over-Year Revenue Growth of 25% for the Fourth Quarter and 28% for the Full Year 2024,inspire medical systems inc announces preliminary results for the fourth quarter and full year 2024 and provides initial 2025 revenue guidance inspire reports yearoveryear revenue growth of 25 for the fourth quarter and 28 for the full year 2024 inspire reports yearoveryear revenue growth of 25 for the fourth quarter and 28 for the full year 2024,360.1481018066406,-0.012798789125349819
STRYKER CORPORATION,2025-01-13,Reviewing Microbot Medical (NASDAQ:MBOT) and CVR Medical (OTCMKTS:CRRVF),"CVR Medical (OTCMKTS:CRRVF – Get Free Report) and Microbot Medical (NASDAQ:MBOT – Get Free Report) are both small-cap medical companies, but which is the superior stock? We will contrast the two businesses based on the strength of their valuation, earnings, i…",reviewing microbot medical nasdaqmbot and cvr medical otcmktscrrvf cvr medical otcmktscrrvf  get free report and microbot medical nasdaqmbot  get free report are both smallcap medical companies but which is the superior stock we will contrast the two businesses based on the strength of their valuation earnings i,360.1481018066406,-0.012798789125349819
STRYKER CORPORATION,2025-01-10,Stryker’s (SYK) “Market Perform” Rating Reiterated at JMP Securities,"JMP Securities reissued their market perform rating on shares of Stryker (NYSE:SYK – Free Report) in a research note issued to investors on Tuesday morning,Benzinga reports. Several other research firms have also recently commented on SYK. Robert W. Baird rai…",strykers syk market perform rating reiterated at jmp securities jmp securities reissued their market perform rating on shares of stryker nysesyk  free report in a research note issued to investors on tuesday morningbenzinga reports several other research firms have also recently commented on syk robert w baird rai,364.81732177734375,0.004284513901735343
STRYKER CORPORATION,2025-01-08,Stryker (NYSE:SYK) Receives “Buy” Rating from Needham & Company LLC,"Needham & Company LLC restated their buy rating on shares of Stryker (NYSE:SYK – Free Report) in a report released on Tuesday,Benzinga reports. The firm currently has a $442.00 price objective on the medical technology company’s stock. Several other brokerage…",stryker nysesyk receives buy rating from needham  company llc needham  company llc restated their buy rating on shares of stryker nysesyk  free report in a report released on tuesdaybenzinga reports the firm currently has a 44200 price objective on the medical technology companys stock several other brokerage,363.26092529296875,0.025114117499945854
STRYKER CORPORATION,2025-01-08,Stryker Corporation Enters into Agreement to Acquire Inari Medical Inc.,"Stryker Corporation, a leading medical technologies company, has announced its definitive agreement to acquire Inari Medical, Inc., a Delaware corporation. The Agreement and Plan of Merger were entered into on January 6, 2025. Pursuant to this agreement, an a…",stryker corporation enters into agreement to acquire inari medical inc stryker corporation a leading medical technologies company has announced its definitive agreement to acquire inari medical inc a delaware corporation the agreement and plan of merger were entered into on january 6 2025 pursuant to this agreement an a,363.26092529296875,0.025114117499945854
STRYKER CORPORATION,2025-01-08,Weekly Research Analysts’ Ratings Changes for Stryker (SYK),Stryker (NYSE: SYK) recently received a number of ratings updates from brokerages and research firms: 1/7/2025 – Stryker had its “outperform” rating reaffirmed by analysts at Royal Bank of Canada. They now have a $425.00 price target on the stock. 1/7/2025 – …,weekly research analysts ratings changes for stryker syk stryker nyse syk recently received a number of ratings updates from brokerages and research firms 172025  stryker had its outperform rating reaffirmed by analysts at royal bank of canada they now have a 42500 price target on the stock 172025  ,363.26092529296875,0.025114117499945854
STRYKER CORPORATION,2025-01-06,Legacy Wealth Management LLC MS Sells 655 Shares of Stryker Co. (NYSE:SYK),"Legacy Wealth Management LLC MS lowered its stake in Stryker Co. (NYSE:SYK – Free Report) by 7.0% in the 4th quarter, Holdings Channel reports. The firm owned 8,716 shares of the medical technology company’s stock after selling 655 shares during the quarter. …",legacy wealth management llc ms sells 655 shares of stryker co nysesyk legacy wealth management llc ms lowered its stake in stryker co nysesyk  free report by 70 in the 4th quarter holdings channel reports the firm owned 8716 shares of the medical technology companys stock after selling 655 shares during the quarter ,360.5272216796875,-0.00044259292272674777
STRYKER CORPORATION,2025-01-06,"Nordea Investment Management AB Acquires 132,513 Shares of Stryker Co. (NYSE:SYK)","Nordea Investment Management AB boosted its position in Stryker Co. (NYSE:SYK – Free Report) by 15.8% during the 4th quarter, according to the company in its most recent Form 13F filing with the SEC. The institutional investor owned 971,735 shares of the medi…",nordea investment management ab acquires 132513 shares of stryker co nysesyk nordea investment management ab boosted its position in stryker co nysesyk  free report by 158 during the 4th quarter according to the company in its most recent form 13f filing with the sec the institutional investor owned 971735 shares of the medi,360.5272216796875,-0.00044259292272674777
STRYKER CORPORATION,2025-01-03,StockNews.com Downgrades Stryker (NYSE:SYK) to Hold,Stryker (NYSE:SYK – Get Free Report) was downgraded by stock analysts at StockNews.com from a “buy” rating to a “hold” rating in a note issued to investors on Wednesday. Several other research analysts also recently issued reports on the stock. Wolfe Research…,stocknewscom downgrades stryker nysesyk to hold stryker nysesyk  get free report was downgraded by stock analysts at stocknewscom from a buy rating to a hold rating in a note issued to investors on wednesday several other research analysts also recently issued reports on the stock wolfe research,360.6868591308594,0.0078055345033292145
STRYKER CORPORATION,2024-12-31,Reviewing Inspire Medical Systems (NYSE:INSP) & Microbot Medical (NASDAQ:MBOT),"Inspire Medical Systems (NYSE:INSP – Get Free Report) and Microbot Medical (NASDAQ:MBOT – Get Free Report) are both medical companies, but which is the better stock? We will contrast the two companies based on the strength of their analyst recommendations, in…",reviewing inspire medical systems nyseinsp  microbot medical nasdaqmbot inspire medical systems nyseinsp  get free report and microbot medical nasdaqmbot  get free report are both medical companies but which is the better stock we will contrast the two companies based on the strength of their analyst recommendations in,359.2202453613281,-0.0037906287201505684
STRYKER CORPORATION,2024-12-27,Sharps Technology (NASDAQ:STSS) versus Stryker (NYSE:SYK) Critical Comparison,"Stryker (NYSE:SYK – Get Free Report) and Sharps Technology (NASDAQ:STSS – Get Free Report) are both medical companies, but which is the superior stock? We will compare the two companies based on the strength of their earnings, valuation, profitability, risk, …",sharps technology nasdaqstss versus stryker nysesyk critical comparison stryker nysesyk  get free report and sharps technology nasdaqstss  get free report are both medical companies but which is the superior stock we will compare the two companies based on the strength of their earnings valuation profitability risk ,365.4146728515625,-0.006253167208525978
STRYKER CORPORATION,2024-12-18,Stryker (SYK) – Analysts’ Recent Ratings Changes,Stryker (NYSE: SYK) has recently received a number of price target changes and ratings updates: 12/12/2024 – Stryker had its price target raised by analysts at Needham & Company LLC from $409.00 to $442.00. They now have a “buy” rating on the stock. 12/11/202…,stryker syk  analysts recent ratings changes stryker nyse syk has recently received a number of price target changes and ratings updates 12122024  stryker had its price target raised by analysts at needham  company llc from 40900 to 44200 they now have a buy rating on the stock 1211202,357.5113525390625,-0.03139072924340547
STRYKER CORPORATION,2024-12-16,Twenty Companies Spreading Holiday Cheers To Shareholders,"As part of my review process, I  evaluate dividend increases  every week. This process helps me to see how my portfolio holdings are doing. ...",twenty companies spreading holiday cheers to shareholders as part of my review process i  evaluate dividend increases  every week this process helps me to see how my portfolio holdings are doing ,370.9788818359375,-0.005072020796504706
STRYKER CORPORATION,2024-12-13,Citigroup Forecasts Strong Price Appreciation for Stryker (NYSE:SYK) Stock,"Stryker (NYSE:SYK – Get Free Report) had its target price boosted by Citigroup from $411.00 to $450.00 in a research note issued on Wednesday,Benzinga reports. The brokerage currently has a “buy” rating on the medical technology company’s stock. Citigroup’s t…",citigroup forecasts strong price appreciation for stryker nysesyk stock stryker nysesyk  get free report had its target price boosted by citigroup from 41100 to 45000 in a research note issued on wednesdaybenzinga reports the brokerage currently has a buy rating on the medical technology companys stock citigroups t,372.8700866699219,-0.0012264972785968054
STRYKER CORPORATION,2024-12-13,Stryker (NYSE:SYK) Earns Outperform Rating from Royal Bank of Canada,"Stryker (NYSE:SYK – Get Free Report)‘s stock had its “outperform” rating reaffirmed by equities researchers at Royal Bank of Canada in a report released on Wednesday,Benzinga reports. They presently have a $425.00 target price on the medical technology compan…",stryker nysesyk earns outperform rating from royal bank of canada stryker nysesyk  get free reports stock had its outperform rating reaffirmed by equities researchers at royal bank of canada in a report released on wednesdaybenzinga reports they presently have a 42500 target price on the medical technology compan,372.8700866699219,-0.0012264972785968054
STRYKER CORPORATION,2024-12-12,"Needham names Stryker top pick for 2025 on new products, margin gains","Needham names Stryker top pick for 2025 on new products, margin gains",needham names stryker top pick for 2025 on new products margin gains needham names stryker top pick for 2025 on new products margin gains,373.3279724121094,-0.002924259494735071
STRYKER CORPORATION,2024-12-09,Financial Analysis: Stryker (NYSE:SYK) vs. Neuronetics (NASDAQ:STIM),"Neuronetics (NASDAQ:STIM – Get Free Report) and Stryker (NYSE:SYK – Get Free Report) are both medical companies, but which is the better business? We will compare the two businesses based on the strength of their institutional ownership, profitability, valuat…",financial analysis stryker nysesyk vs neuronetics nasdaqstim neuronetics nasdaqstim  get free report and stryker nysesyk  get free report are both medical companies but which is the better business we will compare the two businesses based on the strength of their institutional ownership profitability valuat,379.3500061035156,-0.010155300909247877
STRYKER CORPORATION,2024-12-03,Stryker (NYSE:SYK) Upgraded to “Overweight” at Morgan Stanley,"Morgan Stanley upgraded shares of Stryker (NYSE:SYK – Free Report) from an equal weight rating to an overweight rating in a research note issued to investors on Monday morning, MarketBeat reports. They currently have $445.00 price objective on the medical tec…",stryker nysesyk upgraded to overweight at morgan stanley morgan stanley upgraded shares of stryker nysesyk  free report from an equal weight rating to an overweight rating in a research note issued to investors on monday morning marketbeat reports they currently have 44500 price objective on the medical tec,389.16448974609375,0.00343913287205444
STRYKER CORPORATION,2024-11-27,Intech Investment Management LLC Reduces Holdings in Stryker Co. (NYSE:SYK),"Intech Investment Management LLC reduced its stake in Stryker Co. (NYSE:SYK – Free Report) by 17.9% during the third quarter, Holdings Channel.com reports. The firm owned 3,868 shares of the medical technology company’s stock after selling 841 shares during t…",intech investment management llc reduces holdings in stryker co nysesyk intech investment management llc reduced its stake in stryker co nysesyk  free report by 179 during the third quarter holdings channelcom reports the firm owned 3868 shares of the medical technology companys stock after selling 841 shares during t,386.3475646972656,-0.004028622351663458
STRYKER CORPORATION,2024-11-22,Stryker (NYSE:SYK) Lowered to Hold Rating by StockNews.com,Stryker (NYSE:SYK – Get Free Report) was downgraded by investment analysts at StockNews.com from a “buy” rating to a “hold” rating in a note issued to investors on Friday. SYK has been the subject of a number of other research reports. Stifel Nicolaus reduced…,stryker nysesyk lowered to hold rating by stocknewscom stryker nysesyk  get free report was downgraded by investment analysts at stocknewscom from a buy rating to a hold rating in a note issued to investors on friday syk has been the subject of a number of other research reports stifel nicolaus reduced,383.07275390625,-0.013559295661297321
STRYKER CORPORATION,2024-11-22,Zacks Research Has Bullish Forecast for Stryker Q1 Earnings,"Stryker Co. (NYSE:SYK – Free Report) – Equities researchers at Zacks Research increased their Q1 2025 earnings estimates for shares of Stryker in a report issued on Monday, November 18th. Zacks Research analyst I. Bandyopadhyay now anticipates that the medica…",zacks research has bullish forecast for stryker q1 earnings stryker co nysesyk  free report  equities researchers at zacks research increased their q1 2025 earnings estimates for shares of stryker in a report issued on monday november 18th zacks research analyst i bandyopadhyay now anticipates that the medica,383.07275390625,-0.013559295661297321
STRYKER CORPORATION,2024-11-20,Empowered Funds LLC Acquires 399 Shares of Stryker Co. (NYSE:SYK),"Empowered Funds LLC lifted its holdings in shares of Stryker Co. (NYSE:SYK – Free Report) by 6.5% during the 3rd quarter, according to the company in its most recent filing with the Securities and Exchange Commission (SEC). The institutional investor owned 6,…",empowered funds llc acquires 399 shares of stryker co nysesyk empowered funds llc lifted its holdings in shares of stryker co nysesyk  free report by 65 during the 3rd quarter according to the company in its most recent filing with the securities and exchange commission sec the institutional investor owned 6,383.89892578125,-0.007718429179369712
STRYKER CORPORATION,2024-11-13,Stryker Co. (NYSE:SYK) Stock Position Lowered by Covestor Ltd,"Covestor Ltd trimmed its position in shares of Stryker Co. (NYSE:SYK – Free Report) by 14.2% during the 3rd quarter, according to the company in its most recent filing with the SEC. The institutional investor owned 266 shares of the medical technology company…",stryker co nysesyk stock position lowered by covestor ltd covestor ltd trimmed its position in shares of stryker co nysesyk  free report by 142 during the 3rd quarter according to the company in its most recent filing with the sec the institutional investor owned 266 shares of the medical technology company,386.546630859375,0.003177430242302437
STRYKER CORPORATION,2024-11-11,Leavell Investment Management Inc. Boosts Stock Position in Stryker Co. (NYSE:SYK),"Leavell Investment Management Inc. lifted its position in shares of Stryker Co. (NYSE:SYK – Free Report) by 24.4% during the third quarter, according to the company in its most recent filing with the Securities and Exchange Commission. The institutional inves…",leavell investment management inc boosts stock position in stryker co nysesyk leavell investment management inc lifted its position in shares of stryker co nysesyk  free report by 244 during the third quarter according to the company in its most recent filing with the securities and exchange commission the institutional inves,377.1103820800781,0.0077134753036192105
STRYKER CORPORATION,2024-11-05,Stryker's SWOT analysis: medical device giant's stock shows robust growth,Stryker's SWOT analysis: medical device giant's stock shows robust growth,strykers swot analysis medical device giants stock shows robust growth strykers swot analysis medical device giants stock shows robust growth,368.1519775390625,0.008067562798846462
STRYKER CORPORATION,2024-11-01,Needham & Company LLC Increases Stryker (NYSE:SYK) Price Target to $409.00,"Stryker (NYSE:SYK – Get Free Report) had its price objective lifted by investment analysts at Needham & Company LLC from $393.00 to $409.00 in a note issued to investors on Wednesday, Benzinga reports. The firm presently has a “buy” rating on the medical tech…",needham  company llc increases stryker nysesyk price target to 40900 stryker nysesyk  get free report had its price objective lifted by investment analysts at needham  company llc from 39300 to 40900 in a note issued to investors on wednesday benzinga reports the firm presently has a buy rating on the medical tech,365.4544982910156,0.030509686618757748
STRYKER CORPORATION,2024-11-01,Stryker Co. (NYSE:SYK) Shares Bought by Strategic Blueprint LLC,"Strategic Blueprint LLC raised its holdings in Stryker Co. (NYSE:SYK – Free Report) by 5.8% during the third quarter, HoldingsChannel.com reports. The firm owned 1,426 shares of the medical technology company’s stock after buying an additional 78 shares durin…",stryker co nysesyk shares bought by strategic blueprint llc strategic blueprint llc raised its holdings in stryker co nysesyk  free report by 58 during the third quarter holdingschannelcom reports the firm owned 1426 shares of the medical technology companys stock after buying an additional 78 shares durin,365.4544982910156,0.030509686618757748
