ticker,date,title,description,clean_text,Close,Daily_Return
STRYKER CORPORATION,2025-05-05,Evercore ISI Issues Pessimistic Forecast for Stryker (NYSE:SYK) Stock Price,"Stryker (NYSE:SYK – Free Report) had its price objective cut by Evercore ISI from $400.00 to $390.00 in a research report sent to investors on Friday morning,Benzinga reports. They currently have an outperform rating on the medical technology company’s stock.…",evercore isi issues pessimistic forecast for stryker nysesyk stock price stryker nysesyk  free report had its price objective cut by evercore isi from 40000 to 39000 in a research report sent to investors on friday morningbenzinga reports they currently have an outperform rating on the medical technology companys stock,381.3599853515625,0.008302004443776267
STRYKER CORPORATION,2025-05-01,Reviewing Microbot Medical (NASDAQ:MBOT) & Motus GI (NASDAQ:MOTS),"Microbot Medical (NASDAQ:MBOT – Get Free Report) and Motus GI (NASDAQ:MOTS – Get Free Report) are both small-cap medical companies, but which is the superior investment? We will compare the two businesses based on the strength of their risk, valuation, analys…",reviewing microbot medical nasdaqmbot  motus gi nasdaqmots microbot medical nasdaqmbot  get free report and motus gi nasdaqmots  get free report are both smallcap medical companies but which is the superior investment we will compare the two businesses based on the strength of their risk valuation analys,373.989990234375,0.00018714378510842344
STRYKER CORPORATION,2025-04-29,Stryker (SYK) Projected to Post Earnings on Thursday,"Stryker (NYSE:SYK – Get Free Report) is expected to issue its Q1 2025 quarterly earnings data after the market closes on Thursday, May 1st. Analysts expect the company to announce earnings of $2.76 per share and revenue of $5.68 billion for the quarter. Stryk…",stryker syk projected to post earnings on thursday stryker nysesyk  get free report is expected to issue its q1 2025 quarterly earnings data after the market closes on thursday may 1st analysts expect the company to announce earnings of 276 per share and revenue of 568 billion for the quarter stryk,370.9200134277344,0.01208770583482055
STRYKER CORPORATION,2025-04-25,Head-To-Head Comparison: Optex Systems (NASDAQ:OPXS) vs. Odysight.Ai (NASDAQ:ODYS),"Optex Systems (NASDAQ:OPXS – Get Free Report) and Odysight.Ai (NASDAQ:ODYS – Get Free Report) are both small-cap aerospace companies, but which is the better investment? We will compare the two businesses based on the strength of their valuation, risk, analys…",headtohead comparison optex systems nasdaqopxs vs odysightai nasdaqodys optex systems nasdaqopxs  get free report and odysightai nasdaqodys  get free report are both smallcap aerospace companies but which is the better investment we will compare the two businesses based on the strength of their valuation risk analys,365.05999755859375,0.011106522368654392
STRYKER CORPORATION,2025-04-22,Head-To-Head Contrast: Spectral Medical (OTCMKTS:EDTXF) vs. Stryker (NYSE:SYK),"Spectral Medical (OTCMKTS:EDTXF – Get Free Report) and Stryker (NYSE:SYK – Get Free Report) are both medical companies, but which is the better stock? We will contrast the two companies based on the strength of their earnings, profitability, institutional own…",headtohead contrast spectral medical otcmktsedtxf vs stryker nysesyk spectral medical otcmktsedtxf  get free report and stryker nysesyk  get free report are both medical companies but which is the better stock we will contrast the two companies based on the strength of their earnings profitability institutional own,348.1199951171875,0.02511852195672315
STRYKER CORPORATION,2025-04-16,Stryker (NYSE:SYK) Stock Unloaded Rep. Jefferson Shreve,"Representative Jefferson Shreve (R-Indiana) recently sold shares of Stryker Co. (NYSE:SYK). In a filing disclosed on April 11th, the Representative disclosed that they had sold between $50,001 and $100,000 in Stryker stock on March 13th. The trade occurred in…",stryker nysesyk stock unloaded rep jefferson shreve representative jefferson shreve rindiana recently sold shares of stryker co nysesyk in a filing disclosed on april 11th the representative disclosed that they had sold between 50001 and 100000 in stryker stock on march 13th the trade occurred in,346.6700134277344,-0.0003747819198655078
STRYKER CORPORATION,2025-04-15,Boston Scientific Corporation (BSX): A Bull Case Theory,"We came across a bullish thesis on Boston Scientific Corporation (BSX) on Substack by Magnus Ofstad. In this article, we will summarize the bulls’ thesis on ...",boston scientific corporation bsx a bull case theory we came across a bullish thesis on boston scientific corporation bsx on substack by magnus ofstad in this article we will summarize the bulls thesis on ,346.79998779296875,-0.018731326419688665
STRYKER CORPORATION,2025-04-14,Optex Systems (NASDAQ:OPXS) vs. Odysight.Ai (NASDAQ:ODYS) Financial Review,"Odysight.Ai (NASDAQ:ODYS – Get Free Report) and Optex Systems (NASDAQ:OPXS – Get Free Report) are both small-cap business services companies, but which is the superior investment? We will compare the two companies based on the strength of their valuation, div…",optex systems nasdaqopxs vs odysightai nasdaqodys financial review odysightai nasdaqodys  get free report and optex systems nasdaqopxs  get free report are both smallcap business services companies but which is the superior investment we will compare the two companies based on the strength of their valuation div,353.4200134277344,0.008964299016159138
STRYKER CORPORATION,2025-04-10,NVIDIA (NASDAQ:NVDA) Shares Acquired Rep. Jared Moskowitz,"Representative Jared Moskowitz (D-Florida) recently bought shares of NVIDIA Co. (NASDAQ:NVDA). In a filing disclosed on April 08th, the Representative disclosed that they had bought between $1,001 and $15,000 in NVIDIA stock on March 10th. The trade occurred …",nvidia nasdaqnvda shares acquired rep jared moskowitz representative jared moskowitz dflorida recently bought shares of nvidia co nasdaqnvda in a filing disclosed on april 08th the representative disclosed that they had bought between 1001 and 15000 in nvidia stock on march 10th the trade occurred ,348.3900146484375,-0.04016857184679645
STRYKER CORPORATION,2025-04-08,Stryker Co. (NYSE:SYK) Receives Consensus Recommendation of “Moderate Buy” from Analysts,"Stryker Co. (NYSE:SYK – Get Free Report) has been given a consensus rating of “Moderate Buy” by the twenty analysts that are currently covering the company, MarketBeat Ratings reports. Four equities research analysts have rated the stock with a hold recommend…",stryker co nysesyk receives consensus recommendation of moderate buy from analysts stryker co nysesyk  get free report has been given a consensus rating of moderate buy by the twenty analysts that are currently covering the company marketbeat ratings reports four equities research analysts have rated the stock with a hold recommend,337.3699951171875,-0.023078708823825456
STRYKER CORPORATION,2025-04-01,Danaher Corporation (DHR): One of the Best Healthcare Stocks to Buy According to Billionaires,"We recently published a list of 10 Best Healthcare Stocks to Buy According to Billionaires. In this article, we are going to take a look at where Danaher...",danaher corporation dhr one of the best healthcare stocks to buy according to billionaires we recently published a list of 10 best healthcare stocks to buy according to billionaires in this article we are going to take a look at where danaher,373.29998779296875,0.002820652230943521
STRYKER CORPORATION,2025-04-01,CVS Health (CVS): One of the Best Healthcare Stocks to Buy According to Billionaires,"We recently published a list of 10 Best Healthcare Stocks to Buy According to Billionaires. In this article, we are going to take a look at where CVS Health ...",cvs health cvs one of the best healthcare stocks to buy according to billionaires we recently published a list of 10 best healthcare stocks to buy according to billionaires in this article we are going to take a look at where cvs health ,373.29998779296875,0.002820652230943521
STRYKER CORPORATION,2025-03-24,Stryker’s (SYK) “Buy” Rating Reiterated at Needham & Company LLC,"Needham & Company LLC reissued their buy rating on shares of Stryker (NYSE:SYK – Free Report) in a report released on Friday,Benzinga reports. Needham & Company LLC currently has a $442.00 price target on the medical technology company’s stock. Other equities…",strykers syk buy rating reiterated at needham  company llc needham  company llc reissued their buy rating on shares of stryker nysesyk  free report in a report released on fridaybenzinga reports needham  company llc currently has a 44200 price target on the medical technology companys stock other equities,373.407470703125,0.0085150579348523
STRYKER CORPORATION,2025-03-20,Meet The Billionaire March Madness Boosters,Inside the C-Suite 16—a group of ultra-rich fans using their combined net worth of $357 billion to bankroll the schools in the 2025 NCAA men’s basketball tournament.,meet the billionaire march madness boosters inside the csuite 16a group of ultrarich fans using their combined net worth of 357 billion to bankroll the schools in the 2025 ncaa mens basketball tournament,373.35760498046875,-0.010130837331574494
STRYKER CORPORATION,2025-03-17,Analysts Set Stryker Co. (NYSE:SYK) Target Price at $421.90,"Stryker Co. (NYSE:SYK – Get Free Report) has earned a consensus recommendation of “Moderate Buy” from the twenty ratings firms that are presently covering the company, MarketBeat Ratings reports. Four analysts have rated the stock with a hold recommendation a…",analysts set stryker co nysesyk target price at 42190 stryker co nysesyk  get free report has earned a consensus recommendation of moderate buy from the twenty ratings firms that are presently covering the company marketbeat ratings reports four analysts have rated the stock with a hold recommendation a,372.6292724609375,0.010716295387726671
STRYKER CORPORATION,2025-03-13,Stryker Co. (NYSE:SYK) Shares Bought by Assetmark Inc.,"Assetmark Inc. lifted its position in shares of Stryker Co. (NYSE:SYK – Free Report) by 28.1% in the fourth quarter, Holdings Channel reports. The institutional investor owned 1,298 shares of the medical technology company’s stock after acquiring an additiona…",stryker co nysesyk shares bought by assetmark inc assetmark inc lifted its position in shares of stryker co nysesyk  free report by 281 in the fourth quarter holdings channel reports the institutional investor owned 1298 shares of the medical technology companys stock after acquiring an additiona,362.8219299316406,-0.000494668567435963
STRYKER CORPORATION,2025-03-12,"Orthopedics Robotic-Assisted Surgery Industry Forecast 2025-2035 - By 2035, Cost-Effective Robotic Systems Will Propel Market Expansion in Emerging Regions",Spinal Surgery Innovation Gains Momentum as Trauma and Degenerative Disorders Surge Spinal Surgery Innovation Gains Momentum as Trauma and Degenerative Disorders Surge,orthopedics roboticassisted surgery industry forecast 20252035  by 2035 costeffective robotic systems will propel market expansion in emerging regions spinal surgery innovation gains momentum as trauma and degenerative disorders surge spinal surgery innovation gains momentum as trauma and degenerative disorders surge,363.0014953613281,-0.003969523970297706
STRYKER CORPORATION,2025-03-11,Comparing Nemaura Medical (NASDAQ:NMRD) and Microbot Medical (NASDAQ:MBOT),"Nemaura Medical (NASDAQ:NMRD – Get Free Report) and Microbot Medical (NASDAQ:MBOT – Get Free Report) are both small-cap medical companies, but which is the better investment? We will contrast the two businesses based on the strength of their earnings, profita…",comparing nemaura medical nasdaqnmrd and microbot medical nasdaqmbot nemaura medical nasdaqnmrd  get free report and microbot medical nasdaqmbot  get free report are both smallcap medical companies but which is the better investment we will contrast the two businesses based on the strength of their earnings profita,364.44818115234375,-0.013049764209378645
STRYKER CORPORATION,2025-03-07,Can SYK Stock Plunge Below $300?,This new device addresses the ongoing nursing shortage by streamlining workflows and providing seamless access to critical people and information.,can syk stock plunge below 300 this new device addresses the ongoing nursing shortage by streamlining workflows and providing seamless access to critical people and information,378.4258728027344,-0.007873241492050709
STRYKER CORPORATION,2025-03-06,Stryker (NYSE:SYK) Downgraded by StockNews.com to “Hold”,Stryker (NYSE:SYK – Get Free Report) was downgraded by equities research analysts at StockNews.com from a “buy” rating to a “hold” rating in a research report issued to clients and investors on Thursday. SYK has been the topic of a number of other research re…,stryker nysesyk downgraded by stocknewscom to hold stryker nysesyk  get free report was downgraded by equities research analysts at stocknewscom from a buy rating to a hold rating in a research report issued to clients and investors on thursday syk has been the topic of a number of other research re,381.428955078125,-0.03381431590336148
STRYKER CORPORATION,2025-02-28,Citigroup Reiterates “Buy” Rating for Stryker (NYSE:SYK),"Stryker (NYSE:SYK – Get Free Report)‘s stock had its “buy” rating reaffirmed by research analysts at Citigroup in a research report issued on Wednesday, Marketbeat reports. They currently have a $450.00 price objective on the medical technology company’s stoc…",citigroup reiterates buy rating for stryker nysesyk stryker nysesyk  get free reports stock had its buy rating reaffirmed by research analysts at citigroup in a research report issued on wednesday marketbeat reports they currently have a 45000 price objective on the medical technology companys stoc,385.3000183105469,-0.006968322667097238
STRYKER CORPORATION,2025-02-27,StockNews.com Downgrades Stryker (NYSE:SYK) to Hold,Stryker (NYSE:SYK – Get Free Report) was downgraded by StockNews.com from a “buy” rating to a “hold” rating in a research report issued on Tuesday. SYK has been the topic of several other research reports. Morgan Stanley raised Stryker from an “equal weight” …,stocknewscom downgrades stryker nysesyk to hold stryker nysesyk  get free report was downgraded by stocknewscom from a buy rating to a hold rating in a research report issued on tuesday syk has been the topic of several other research reports morgan stanley raised stryker from an equal weight ,388.0037536621094,-0.007249733230868194
STRYKER CORPORATION,2025-02-21,Sight Sciences (NASDAQ:SGHT) & Microbot Medical (NASDAQ:MBOT) Head to Head Survey,"Microbot Medical (NASDAQ:MBOT – Get Free Report) and Sight Sciences (NASDAQ:SGHT – Get Free Report) are both small-cap medical companies, but which is the better business? We will compare the two businesses based on the strength of their valuation, risk, anal…",sight sciences nasdaqsght  microbot medical nasdaqmbot head to head survey microbot medical nasdaqmbot  get free report and sight sciences nasdaqsght  get free report are both smallcap medical companies but which is the better business we will compare the two businesses based on the strength of their valuation risk anal,381.8978576660156,-0.009394189034603317
STRYKER CORPORATION,2025-02-18,Critical Analysis: Microbot Medical (NASDAQ:MBOT) and Revolutions Medical (OTCMKTS:RMCP),"Revolutions Medical (OTCMKTS:RMCP – Get Free Report) and Microbot Medical (NASDAQ:MBOT – Get Free Report) are both medical companies, but which is the better business? We will compare the two companies based on the strength of their risk, analyst recommendati…",critical analysis microbot medical nasdaqmbot and revolutions medical otcmktsrmcp revolutions medical otcmktsrmcp  get free report and microbot medical nasdaqmbot  get free report are both medical companies but which is the better business we will compare the two companies based on the strength of their risk analyst recommendati,384.7213134765625,0.0011163001823863983
STRYKER CORPORATION,2025-02-12,Barclays Raises Stryker (NYSE:SYK) Price Target to $443.00,"Stryker (NYSE:SYK – Get Free Report) had its price objective increased by stock analysts at Barclays from $418.00 to $443.00 in a research note issued to investors on Monday,Benzinga reports. The brokerage currently has an “overweight” rating on the medical t…",barclays raises stryker nysesyk price target to 44300 stryker nysesyk  get free report had its price objective increased by stock analysts at barclays from 41800 to 44300 in a research note issued to investors on mondaybenzinga reports the brokerage currently has an overweight rating on the medical t,384.7413024902344,-0.012420645160077348
STRYKER CORPORATION,2025-01-31,Stryker (NYSE:SYK) Given New $440.00 Price Target at Stifel Nicolaus,"Stryker (NYSE:SYK – Get Free Report) had its target price hoisted by investment analysts at Stifel Nicolaus from $400.00 to $440.00 in a report released on Wednesday,Benzinga reports. The firm presently has a “buy” rating on the medical technology company’s s…",stryker nysesyk given new 44000 price target at stifel nicolaus stryker nysesyk  get free report had its target price hoisted by investment analysts at stifel nicolaus from 40000 to 44000 in a report released on wednesdaybenzinga reports the firm presently has a buy rating on the medical technology companys s,390.38824462890625,0.0022027360118506145
STRYKER CORPORATION,2025-01-31,Stryker (NYSE:SYK) Given New $435.00 Price Target at Canaccord Genuity Group,"Stryker (NYSE:SYK – Get Free Report) had its price target raised by research analysts at Canaccord Genuity Group from $420.00 to $435.00 in a report issued on Wednesday,Benzinga reports. The firm currently has a “buy” rating on the medical technology company’…",stryker nysesyk given new 43500 price target at canaccord genuity group stryker nysesyk  get free report had its price target raised by research analysts at canaccord genuity group from 42000 to 43500 in a report issued on wednesdaybenzinga reports the firm currently has a buy rating on the medical technology company,390.38824462890625,0.0022027360118506145
STRYKER CORPORATION,2025-01-31,Roth Capital Weighs in on Stryker’s Q1 Earnings (NYSE:SYK),"Stryker Co. (NYSE:SYK – Free Report) – Stock analysts at Roth Capital issued their Q1 2025 EPS estimates for Stryker in a research report issued to clients and investors on Wednesday, January 29th. Roth Capital analyst J. Wittes expects that the medical techn…",roth capital weighs in on strykers q1 earnings nysesyk stryker co nysesyk  free report  stock analysts at roth capital issued their q1 2025 eps estimates for stryker in a research report issued to clients and investors on wednesday january 29th roth capital analyst j wittes expects that the medical techn,390.38824462890625,0.0022027360118506145
STRYKER CORPORATION,2025-01-28,Stryker reports 2024 operating results and 2025 outlook,"Portage, Michigan, Jan.  28, 2025  (GLOBE NEWSWIRE) -- Stryker (NYSE:SYK) reported operating results for the fourth quarter and full year of 2024: ...",stryker reports 2024 operating results and 2025 outlook portage michigan jan  28 2025  globe newswire  stryker nysesyk reported operating results for the fourth quarter and full year of 2024 ,394.2393493652344,-0.011877946941514117
STRYKER CORPORATION,2025-01-28,"RFG Advisory LLC Has $474,000 Position in Stryker Co. (NYSE:SYK)","RFG Advisory LLC grew its holdings in Stryker Co. (NYSE:SYK – Free Report) by 4.4% in the fourth quarter, according to the company in its most recent 13F filing with the SEC. The institutional investor owned 1,316 shares of the medical technology company’s st…",rfg advisory llc has 474000 position in stryker co nysesyk rfg advisory llc grew its holdings in stryker co nysesyk  free report by 44 in the fourth quarter according to the company in its most recent 13f filing with the sec the institutional investor owned 1316 shares of the medical technology companys st,394.2393493652344,-0.011877946941514117
STRYKER CORPORATION,2025-01-28,Stock Market Live Updates: Stock to buy today: Bank of India (₹104.30) - BUY,"Sensex, Nifty, Share Prices LIVE: The short-term outlook is bullish for the Bank of India. The stock began the week on a positive note, surging 6 per cent on Monday. A complex inverted head and shoulder pattern is visible on the daily chart. The neckline supp…",stock market live updates stock to buy today bank of india 10430  buy sensex nifty share prices live the shortterm outlook is bullish for the bank of india the stock began the week on a positive note surging 6 per cent on monday a complex inverted head and shoulder pattern is visible on the daily chart the neckline supp,394.2393493652344,-0.011877946941514117
STRYKER CORPORATION,2025-01-28,"Share Market Highlights: Sensex, Nifty recover from two-day decline, powered by bank stocks","Sensex, Nifty updates on 28 January 2025: Indian stock indices, Sensex and Nifty, bounced back on Tuesday after two days of significant declines, spurred by strong buying in banking and rate-sensitive sectors following the Reserve Bank of India’s decision to …",share market highlights sensex nifty recover from twoday decline powered by bank stocks sensex nifty updates on 28 january 2025 indian stock indices sensex and nifty bounced back on tuesday after two days of significant declines spurred by strong buying in banking and ratesensitive sectors following the reserve bank of indias decision to ,394.2393493652344,-0.011877946941514117
STRYKER CORPORATION,2025-01-24,"$HAREHOLDER ALERT: The M&A Class Action Firm Urges Stockholders of NARI, DFS, LBRDA, CCRN to Act Now","NEW YORK, Jan. 24, 2025 (GLOBE NEWSWIRE) -- Monteverde & Associates PC
 (the “M&A Class Action Firm”), has recovered millions of dollars for shareholders and is recognized as a Top 50 Firm by ISS Securities Class Action Services Report. We are headquartered …","hareholder alert the ma class action firm urges stockholders of nari dfs lbrda ccrn to act now new york jan 24 2025 globe newswire  monteverde  associates pc
 the ma class action firm has recovered millions of dollars for shareholders and is recognized as a top 50 firm by iss securities class action services report we are headquartered ",393.4012756347656,0.0020583788261223646
STRYKER CORPORATION,2025-01-24,"SHAREHOLDER INVESTIGATION: Halper Sadeh LLC Investigates CCRN, NARI, VTS, QTRX on Behalf of Shareholders","NEW YORK, Jan. 24, 2025 (GLOBE NEWSWIRE) -- Halper Sadeh LLC, an investor rights law firm, is investigating the following companies for potential violations of the federal securities laws and/or breaches of fiduciary duties to shareholders relating to:",shareholder investigation halper sadeh llc investigates ccrn nari vts qtrx on behalf of shareholders new york jan 24 2025 globe newswire  halper sadeh llc an investor rights law firm is investigating the following companies for potential violations of the federal securities laws andor breaches of fiduciary duties to shareholders relating to,393.4012756347656,0.0020583788261223646
STRYKER CORPORATION,2025-01-24,"Kuehn Law Encourages NARI, QTRX, CCRN, and VTS Investors to Contact Law Firm","Kuehn Law Encourages NARI, QTRX, CCRN, and VTS Investors to Contact Law Firm......",kuehn law encourages nari qtrx ccrn and vts investors to contact law firm kuehn law encourages nari qtrx ccrn and vts investors to contact law firm,393.4012756347656,0.0020583788261223646
STRYKER CORPORATION,2025-01-24,Ameritas Advisory Services LLC Cuts Stock Position in Stryker Co. (NYSE:SYK),"Ameritas Advisory Services LLC lowered its position in shares of Stryker Co. (NYSE:SYK – Free Report) by 33.7% in the 4th quarter, according to its most recent Form 13F filing with the Securities & Exchange Commission. The institutional investor owned 1,051 s…",ameritas advisory services llc cuts stock position in stryker co nysesyk ameritas advisory services llc lowered its position in shares of stryker co nysesyk  free report by 337 in the 4th quarter according to its most recent form 13f filing with the securities  exchange commission the institutional investor owned 1051 s,393.4012756347656,0.0020583788261223646
STRYKER CORPORATION,2025-01-22,StockNews.com Downgrades Stryker (NYSE:SYK) to Hold,Stryker (NYSE:SYK – Get Free Report) was downgraded by research analysts at StockNews.com from a “buy” rating to a “hold” rating in a report released on Wednesday. SYK has been the topic of a number of other research reports. Royal Bank of Canada reiterated a…,stocknewscom downgrades stryker nysesyk to hold stryker nysesyk  get free report was downgraded by research analysts at stocknewscom from a buy rating to a hold rating in a report released on wednesday syk has been the topic of a number of other research reports royal bank of canada reiterated a,389.590087890625,-0.01354050436895149
STRYKER CORPORATION,2025-01-17,Brookstone Capital Management Boosts Stock Holdings in Stryker Co. (NYSE:SYK),"Brookstone Capital Management grew its position in Stryker Co. (NYSE:SYK – Free Report) by 29.6% in the 4th quarter, according to the company in its most recent Form 13F filing with the Securities and Exchange Commission (SEC). The fund owned 3,094 shares of …",brookstone capital management boosts stock holdings in stryker co nysesyk brookstone capital management grew its position in stryker co nysesyk  free report by 296 in the 4th quarter according to the company in its most recent form 13f filing with the securities and exchange commission sec the fund owned 3094 shares of ,382.5364074707031,0.004269382672053901
